{
  "$schema": "https://json-schema.org/draft/2020-12/schema",
  "$id": "https://schemas.workspai.dev/wis/core/result-envelope/0.2.0-draft",
  "title": "WisCoreResultEnvelope",
  "description": "SH2 candidate binding for the review-pending WIS Core result envelope.",
  "type": "object",
  "additionalProperties": false,
  "required": [
    "specVersion",
    "coreVersion",
    "schemaId",
    "profile",
    "producer",
    "operation",
    "operationOutcome",
    "scope",
    "generation",
    "status",
    "evidence",
    "freshness",
    "unknowns",
    "omissions",
    "diagnostics",
    "compatibility"
  ],
  "properties": {
    "specVersion": { "$ref": "#/$defs/NonEmptyIdentifier" },
    "coreVersion": { "const": "0.2.0-draft" },
    "schemaId": { "$ref": "#/$defs/NonEmptyIdentifier" },
    "profile": { "$ref": "#/$defs/ProfileReference" },
    "artifactId": { "$ref": "#/$defs/NonEmptyIdentifier" },
    "producer": { "$ref": "#/$defs/ProducerReference" },
    "operation": { "$ref": "#/$defs/NonEmptyIdentifier" },
    "operationOutcome": {
      "enum": ["succeeded", "failed", "cancelled"]
    },
    "scope": { "$ref": "#/$defs/ScopeReference" },
    "generation": { "$ref": "#/$defs/GenerationReference" },
    "status": {
      "enum": ["pass", "attention", "blocked", "partial", "failed"]
    },
    "payload": true,
    "evidence": {
      "type": "array",
      "maxItems": 10000,
      "items": { "$ref": "#/$defs/EvidenceReference" }
    },
    "freshness": { "$ref": "#/$defs/FreshnessSummary" },
    "unknowns": {
      "type": "array",
      "maxItems": 1000,
      "items": { "$ref": "#/$defs/UnknownRecord" }
    },
    "omissions": {
      "type": "array",
      "maxItems": 1000,
      "items": { "$ref": "#/$defs/OmissionRecord" }
    },
    "diagnostics": {
      "type": "array",
      "maxItems": 1000,
      "items": { "$ref": "#/$defs/Diagnostic" }
    },
    "compatibility": { "$ref": "#/$defs/CompatibilitySummary" },
    "extensions": { "$ref": "#/$defs/Extensions" }
  },
  "$defs": {
    "NonEmptyIdentifier": {
      "type": "string",
      "minLength": 1,
      "maxLength": 512
    },
    "PortableRelativeLocator": {
      "type": "string",
      "minLength": 1,
      "maxLength": 4096
    },
    "Timestamp": {
      "type": "string",
      "pattern": "^[0-9]{4}-[0-9]{2}-[0-9]{2}T[0-9]{2}:[0-9]{2}:[0-9]{2}(?:\\.[0-9]{1,9})?Z$"
    },
    "ContractReference": {
      "title": "WisContractReference",
      "type": "object",
      "additionalProperties": false,
      "required": ["id", "version"],
      "properties": {
        "id": { "$ref": "#/$defs/NonEmptyIdentifier" },
        "version": { "$ref": "#/$defs/NonEmptyIdentifier" },
        "profile": { "$ref": "#/$defs/NonEmptyIdentifier" }
      }
    },
    "ProfileReference": {
      "title": "WisProfileReference",
      "type": "object",
      "additionalProperties": false,
      "required": ["id", "version"],
      "properties": {
        "id": { "$ref": "#/$defs/NonEmptyIdentifier" },
        "version": { "$ref": "#/$defs/NonEmptyIdentifier" }
      }
    },
    "ProducerReference": {
      "title": "WisProducerReference",
      "type": "object",
      "additionalProperties": false,
      "required": ["id", "version"],
      "properties": {
        "id": { "$ref": "#/$defs/NonEmptyIdentifier" },
        "version": { "$ref": "#/$defs/NonEmptyIdentifier" },
        "extensions": {
          "type": "array",
          "maxItems": 128,
          "uniqueItems": true,
          "items": { "$ref": "#/$defs/NonEmptyIdentifier" }
        }
      }
    },
    "ProjectScope": {
      "title": "WisProjectScopeReference",
      "type": "object",
      "additionalProperties": false,
      "required": ["kind", "projectIds"],
      "properties": {
        "kind": { "const": "project" },
        "workspaceId": { "$ref": "#/$defs/NonEmptyIdentifier" },
        "projectIds": {
          "type": "array",
          "minItems": 1,
          "maxItems": 10000,
          "uniqueItems": true,
          "items": { "$ref": "#/$defs/NonEmptyIdentifier" }
        }
      }
    },
    "WorkspaceScope": {
      "title": "WisWorkspaceScopeReference",
      "type": "object",
      "additionalProperties": false,
      "required": ["kind", "workspaceId"],
      "properties": {
        "kind": { "const": "workspace" },
        "workspaceId": { "$ref": "#/$defs/NonEmptyIdentifier" }
      }
    },
    "SelectionScope": {
      "title": "WisSelectionScopeReference",
      "type": "object",
      "additionalProperties": false,
      "required": ["kind"],
      "properties": {
        "kind": { "const": "selection" },
        "workspaceId": { "$ref": "#/$defs/NonEmptyIdentifier" },
        "projectIds": {
          "type": "array",
          "minItems": 1,
          "maxItems": 10000,
          "uniqueItems": true,
          "items": { "$ref": "#/$defs/NonEmptyIdentifier" }
        },
        "entityIds": {
          "type": "array",
          "minItems": 1,
          "maxItems": 10000,
          "uniqueItems": true,
          "items": { "$ref": "#/$defs/NonEmptyIdentifier" }
        },
        "selector": {
          "type": "string",
          "minLength": 1,
          "maxLength": 4096
        }
      }
    },
    "OrganizationScope": {
      "title": "WisOrganizationScopeReference",
      "type": "object",
      "additionalProperties": false,
      "required": ["kind", "organizationId"],
      "properties": {
        "kind": { "const": "organization" },
        "organizationId": { "$ref": "#/$defs/NonEmptyIdentifier" },
        "workspaceId": { "$ref": "#/$defs/NonEmptyIdentifier" }
      }
    },
    "ScopeReference": {
      "title": "WisScopeReference",
      "oneOf": [
        { "$ref": "#/$defs/ProjectScope" },
        { "$ref": "#/$defs/WorkspaceScope" },
        { "$ref": "#/$defs/SelectionScope" },
        { "$ref": "#/$defs/OrganizationScope" }
      ]
    },
    "DigestReference": {
      "title": "WisDigestReference",
      "type": "object",
      "additionalProperties": false,
      "required": ["algorithm", "value"],
      "properties": {
        "algorithm": { "$ref": "#/$defs/NonEmptyIdentifier" },
        "value": {
          "type": "string",
          "minLength": 8,
          "maxLength": 1024
        },
        "canonicalization": { "$ref": "#/$defs/NonEmptyIdentifier" }
      }
    },
    "GenerationReference": {
      "title": "WisGenerationReference",
      "type": "object",
      "additionalProperties": false,
      "required": ["id", "generatedAt"],
      "properties": {
        "id": { "$ref": "#/$defs/NonEmptyIdentifier" },
        "generatedAt": { "$ref": "#/$defs/Timestamp" },
        "parents": {
          "type": "array",
          "maxItems": 10000,
          "uniqueItems": true,
          "items": { "$ref": "#/$defs/NonEmptyIdentifier" }
        },
        "contentDigest": { "$ref": "#/$defs/DigestReference" }
      }
    },
    "ArtifactReference": {
      "title": "WisArtifactReference",
      "type": "object",
      "additionalProperties": false,
      "required": ["id", "generationId"],
      "properties": {
        "id": { "$ref": "#/$defs/NonEmptyIdentifier" },
        "generationId": { "$ref": "#/$defs/NonEmptyIdentifier" },
        "schemaId": { "$ref": "#/$defs/NonEmptyIdentifier" },
        "mediaType": {
          "type": "string",
          "minLength": 1,
          "maxLength": 256
        },
        "relativeLocator": { "$ref": "#/$defs/PortableRelativeLocator" }
      }
    },
    "EvidenceReference": {
      "title": "WisEvidenceReference",
      "type": "object",
      "additionalProperties": false,
      "required": ["id", "sourceKind"],
      "properties": {
        "id": { "$ref": "#/$defs/NonEmptyIdentifier" },
        "sourceKind": { "$ref": "#/$defs/NonEmptyIdentifier" },
        "artifact": { "$ref": "#/$defs/ArtifactReference" },
        "relativeLocator": { "$ref": "#/$defs/PortableRelativeLocator" },
        "digest": { "$ref": "#/$defs/DigestReference" },
        "producer": { "$ref": "#/$defs/ProducerReference" }
      }
    },
    "RenewalReference": {
      "title": "WisRenewalReference",
      "type": "object",
      "additionalProperties": false,
      "required": ["operation"],
      "properties": {
        "operation": { "$ref": "#/$defs/NonEmptyIdentifier" },
        "scope": { "$ref": "#/$defs/ScopeReference" }
      }
    },
    "FreshnessSummary": {
      "title": "WisFreshnessSummary",
      "type": "object",
      "additionalProperties": false,
      "required": ["status"],
      "properties": {
        "status": { "enum": ["current", "stale", "unknown"] },
        "evaluatedAt": { "$ref": "#/$defs/Timestamp" },
        "inputGenerations": {
          "type": "array",
          "maxItems": 10000,
          "uniqueItems": true,
          "items": { "$ref": "#/$defs/NonEmptyIdentifier" }
        },
        "invalidationCauses": {
          "type": "array",
          "maxItems": 1000,
          "uniqueItems": true,
          "items": { "$ref": "#/$defs/NonEmptyIdentifier" }
        },
        "renewal": { "$ref": "#/$defs/RenewalReference" }
      }
    },
    "Diagnostic": {
      "title": "WisDiagnostic",
      "type": "object",
      "additionalProperties": false,
      "required": ["code", "severity", "message", "affectsStatus"],
      "properties": {
        "code": { "$ref": "#/$defs/NonEmptyIdentifier" },
        "severity": { "enum": ["info", "warning", "error"] },
        "message": {
          "type": "string",
          "minLength": 1,
          "maxLength": 16384
        },
        "affectsStatus": { "type": "boolean" },
        "scope": { "$ref": "#/$defs/ScopeReference" },
        "entityId": { "$ref": "#/$defs/NonEmptyIdentifier" },
        "causes": {
          "type": "array",
          "maxItems": 100,
          "items": { "$ref": "#/$defs/NonEmptyIdentifier" }
        },
        "evidence": {
          "type": "array",
          "maxItems": 1000,
          "items": { "$ref": "#/$defs/EvidenceReference" }
        },
        "renewal": { "$ref": "#/$defs/RenewalReference" }
      }
    },
    "UnknownRecord": {
      "title": "WisUnknownRecord",
      "type": "object",
      "additionalProperties": false,
      "required": ["code", "subject", "reason", "affectsStatus"],
      "properties": {
        "code": { "$ref": "#/$defs/NonEmptyIdentifier" },
        "subject": { "$ref": "#/$defs/NonEmptyIdentifier" },
        "reason": {
          "type": "string",
          "minLength": 1,
          "maxLength": 16384
        },
        "affectsStatus": { "type": "boolean" },
        "scope": { "$ref": "#/$defs/ScopeReference" }
      }
    },
    "OmissionRecord": {
      "title": "WisOmission",
      "type": "object",
      "additionalProperties": false,
      "required": ["code", "reason", "affectsStatus", "recoverable"],
      "properties": {
        "code": { "$ref": "#/$defs/NonEmptyIdentifier" },
        "reason": {
          "type": "string",
          "minLength": 1,
          "maxLength": 16384
        },
        "affectsStatus": { "type": "boolean" },
        "recoverable": { "type": "boolean" },
        "scope": { "$ref": "#/$defs/ScopeReference" },
        "renewal": { "$ref": "#/$defs/RenewalReference" }
      }
    },
    "CompatibilitySummary": {
      "title": "WisCompatibilitySummary",
      "type": "object",
      "additionalProperties": false,
      "required": ["status"],
      "properties": {
        "status": {
          "enum": ["compatible", "conditionally-compatible", "incompatible"]
        },
        "baseline": { "$ref": "#/$defs/ContractReference" },
        "unsupportedCapabilities": {
          "type": "array",
          "maxItems": 1000,
          "uniqueItems": true,
          "items": { "$ref": "#/$defs/NonEmptyIdentifier" }
        },
        "losses": {
          "type": "array",
          "maxItems": 1000,
          "items": { "$ref": "#/$defs/NonEmptyIdentifier" }
        },
        "migrations": {
          "type": "array",
          "maxItems": 1000,
          "items": { "$ref": "#/$defs/NonEmptyIdentifier" }
        }
      }
    },
    "Extensions": {
      "title": "WisExtensions",
      "type": "object",
      "maxProperties": 32,
      "propertyNames": {
        "pattern": "^[a-z][a-z0-9]*(?:[.-][a-z0-9]+)+$"
      },
      "additionalProperties": true
    }
  }
}
