{
  "specVersion": "wis-candidate",
  "coreVersion": "0.2.0-draft",
  "schemaId": "https://schemas.workspai.dev/wis/core/result-envelope/0.2.0-draft",
  "profile": { "id": "wis.profile.fixture", "version": "0.1.0-draft" },
  "producer": { "id": "fixture-producer", "version": "1.0.0" },
  "operation": "evaluate-fixture",
  "operationOutcome": "succeeded",
  "scope": { "kind": "project", "projectIds": ["project:fixture"] },
  "generation": {
    "id": "generation:partial:1",
    "generatedAt": "2026-08-13T00:00:00.000Z"
  },
  "status": "partial",
  "evidence": [],
  "freshness": { "status": "unknown" },
  "unknowns": [],
  "omissions": [
    {
      "code": "FIXTURE_CAPABILITY_UNAVAILABLE",
      "reason": "The optional fixture capability was not available.",
      "affectsStatus": true,
      "recoverable": true
    }
  ],
  "diagnostics": [],
  "compatibility": {
    "status": "conditionally-compatible",
    "unsupportedCapabilities": ["fixture.optional-capability"]
  },
  "extensions": { "fixture.example": { "preserved": true } }
}
